{
  "schema": "signalbox.reference-deployment/v2",
  "contract_revision": 4,
  "deployment_id": "mintie",
  "display_name": "Mintie",
  "sample_only": true,
  "private_live_bindings": "external-and-absent",
  "reference_platform": {
    "vendor": "GL.iNet",
    "product": "Beryl 7",
    "model": "GL-MT3600BE",
    "normative": false
  },
  "router": {
    "identity": "mintie",
    "display_name": "Mintie",
    "role": "routing-control-plane"
  },
  "instances": {
    "alder": {
      "display_name": "Alder",
      "roles": [
        "general-primary"
      ]
    },
    "rowan": {
      "display_name": "Rowan",
      "roles": [
        "general-secondary"
      ]
    },
    "hearth": {
      "display_name": "Hearth",
      "roles": [
        "claude-residential"
      ]
    }
  },
  "dedicated_gateway_identities": {
    "alder-private": {
      "host_instance": "alder",
      "role": "private-ingress-primary",
      "credential_scope": "dedicated",
      "general_egress_equivalent": false
    },
    "rowan-private": {
      "host_instance": "rowan",
      "role": "private-ingress-secondary",
      "credential_scope": "dedicated",
      "general_egress_equivalent": false
    }
  },
  "canonical_origins": {
    "sample-app": {
      "scheme": "https",
      "hostname_ref": "deployment-owned-and-absent",
      "public_path_required": true,
      "private_path_optional": true
    }
  },
  "health_subjects": {
    "control-plane/mintie": {
      "kind": "control-plane",
      "binding_ref": "mintie"
    },
    "underlay/mintie-wan": {
      "kind": "network-underlay",
      "binding_ref": "mintie"
    },
    "role-binding/alder": {
      "kind": "egress-lane",
      "binding_ref": "alder"
    },
    "role-binding/rowan": {
      "kind": "egress-lane",
      "binding_ref": "rowan"
    },
    "role-binding/hearth": {
      "kind": "egress-lane",
      "binding_ref": "hearth"
    },
    "gateway/alder-private": {
      "kind": "private-ingress-lane",
      "binding_ref": "alder-private"
    },
    "gateway/rowan-private": {
      "kind": "private-ingress-lane",
      "binding_ref": "rowan-private"
    }
  },
  "traffic_policy_ref": "traffic-policy.json",
  "health_profiles_ref": "health-profiles.json",
  "health_aggregate_ref": "health-aggregate.json"
}
